"journal-article-10.2307_27702256-ngram1.txt","Comment: The Dissipation of Social Psychology"
"journal-article-10.2307_27702368-ngram1.txt","The Sociology of Education: Perils and Possibilities"
"journal-article-10.2307_27702491-ngram1.txt","Interviews, Surveys, and the Problem of Ecological Validity"
"journal-article-10.2307_27702520-ngram1.txt","Multidisciplinary Research Funding: A \"Catch 22\" Enigma"
"journal-article-10.2307_27698816-ngram1.txt","Of Methods and Manners for Aspiring Sociologists: 37 Moral Imperatives"
"journal-article-10.2307_27698944-ngram1.txt","journal-article-10.2307_27698944-ngram1.txt"
"journal-article-10.2307_27700456-ngram1.txt","The Nature of Sociological Knowledge"
"journal-article-10.2307_27701263-ngram1.txt","Preliminary Report on Salaries and Selected Characteristics of Sociologists in the 1966 National Science Foundation Register of Scientific and Technical Personnel"
"journal-article-10.2307_27701303-ngram1.txt","Disorganization in Society, but Not Social Disorganization"
"journal-article-10.2307_27701449-ngram1.txt","Quality in Graduate Education: A Re-evaluation of the Rankings of Sociology Departments in the Cartter Report"
"journal-article-10.2307_27702069-ngram1.txt","Academic Expectations for Professional Immortality: A Study of Legitimation"
"journal-article-10.2307_27702092-ngram1.txt","The Misplaced Emphasis on Opportunity for Minorities and Women in Sociology [with Comments]"
"journal-article-10.2307_27702167-ngram1.txt","A Structural Analysis of Sociology"
"journal-article-10.2307_27702306-ngram1.txt","Ethnomethodology"
"journal-article-10.2307_27702360-ngram1.txt","On Making the Most of Participant Observation"
"journal-article-10.2307_27702503-ngram1.txt","\"À la Rechêrche de la Conscience Collective\": Durkheim's Ideological Impact in Turkey and Iran"
"journal-article-10.2307_27702511-ngram1.txt","A Conversation with Paul F. Lazarsfeld"
"journal-article-10.2307_27698480-ngram1.txt","C. Wright Mills, \"The Sociological Imagination\": A Reappraisal"
"journal-article-10.2307_27698566-ngram1.txt","Voting in Professional Associations: The Case of the American Sociological Association Revisited"
"journal-article-10.2307_27698604-ngram1.txt","Structural Explanation in Sociology: The Egalitarian Imperative"
"journal-article-10.2307_27700421-ngram1.txt","Demystifying the Hidden Magic of Producing Sociologists"
"journal-article-10.2307_27700446-ngram1.txt","How to Introduce Sociology at Large Research Universities without Mortgaging Your Soul: Evaluative Observations of a Teaching Experiment"
"journal-article-10.2307_27700473-ngram1.txt","Unveiling the Cloak of Competence: Cultivating Authenticity in Graduate Sociology"
"journal-article-10.2307_27701298-ngram1.txt","New Approaches to the Teaching of Sociology: \"Doing Sociology\" in an Introductory Course"
"journal-article-10.2307_27701445-ngram1.txt","Front Matter"
"journal-article-10.2307_27701472-ngram1.txt","Front Matter"
"journal-article-10.2307_27701727-ngram1.txt","ASA News"
"journal-article-10.2307_27702044-ngram1.txt","University and Departmental Determinants of the Prestige of Sociology Departments"
"journal-article-10.2307_27702143-ngram1.txt","Teaching the Sociology of World Conflicts: A Review of the State of the Field"
"journal-article-10.2307_27702146-ngram1.txt","Ascriptive Career Contingencies of Sociologists: A Longitudinal Analysis"
"journal-article-10.2307_27702175-ngram1.txt","The ASA Code of Ethics on the Protection of Human Beings: Are Students Human Too?"
"journal-article-10.2307_27702244-ngram1.txt","Replies to Scimecca"
"journal-article-10.2307_27702263-ngram1.txt","Letters"
"journal-article-10.2307_41485730-ngram1.txt","The Social Construction of Self Knowledge: A Commentary on the Legacy of Melvin Pollner"
"journal-article-10.2307_27698613-ngram1.txt","\"Acting As a Switchboard\": Mrs. Ethel Sturges Dummer's Role in Sociology"
"journal-article-10.2307_27698973-ngram1.txt","Everett Cherrington Hughes: Sociologist and Mentor \"Sui Generis\""
"journal-article-10.2307_27700328-ngram1.txt","Can a Humanist Criminologist Be a Sociologist?"
"journal-article-10.2307_27700338-ngram1.txt","What Happened to Socialism and Does It Matter?"
"journal-article-10.2307_27700460-ngram1.txt","Reconceptualizing Knowledge Accumulation in Sociology"
"journal-article-10.2307_27701148-ngram1.txt","Communications to the Editor"
"journal-article-10.2307_27701658-ngram1.txt","Official Reports and Proceedings"
"journal-article-10.2307_27701744-ngram1.txt","Simulations, Games, and the Sociologist"
"journal-article-10.2307_27701875-ngram1.txt","Educational Possibilities of Consensual Research"
"journal-article-10.2307_27702381-ngram1.txt","Representations of Merton's Theory of Anomie"
"journal-article-10.2307_27702529-ngram1.txt","The ASA Survey of Graduate Programs: Some Problems with Unproblematic Responses"
"journal-article-10.2307_41217781-ngram1.txt","Reflections from the Middle: Making Sense of Elitism in Our Midst"
"journal-article-10.2307_27698459-ngram1.txt","L. L. Bernard and the Original \"American Sociologist\""
"journal-article-10.2307_27698462-ngram1.txt","And the Walls Come Tumbling Down: Enriching the Sociology of Gender by Systematically Using Other Disciplines"
"journal-article-10.2307_27698761-ngram1.txt","Frederick Jackson Turner and the Democratization of the Electronic Frontier"
"journal-article-10.2307_27700358-ngram1.txt","Questioning Textbook Truth: Suicide Rates and the Hawthorne Effect"
"journal-article-10.2307_27700449-ngram1.txt","The Attitudes of American Sociologists toward Causal Theories of Male Homosexuality"
"journal-article-10.2307_27700462-ngram1.txt","Doing Social Science in Anti-Scientific Times"
"journal-article-10.2307_27701545-ngram1.txt","The Theatrical Analogy Reconsidered"
"journal-article-10.2307_27701631-ngram1.txt","Normative Criteria for Scientific Publication"
"journal-article-10.2307_27701663-ngram1.txt","Sociology and the Historical Perspective"
"journal-article-10.2307_27701775-ngram1.txt","Statement to Senate Subcommittee on Constitutional Rights"
"journal-article-10.2307_27701838-ngram1.txt","Sociological Consulting in Race Relations"
"journal-article-10.2307_27701842-ngram1.txt","Providing Relevant Data"
"journal-article-10.2307_27702038-ngram1.txt","Quantitative and Collaborative Trends in American Sociological Research"
"journal-article-10.2307_27702059-ngram1.txt","The Fall and Rise of the Academic Job Market for Sociologists"
"journal-article-10.2307_27702170-ngram1.txt","A Test of the Bizarre Navel-Gazing Hypothesis"
"journal-article-10.2307_27702245-ngram1.txt","Research Methods for the Study of Conflict and Cooperation"
"journal-article-10.2307_27702305-ngram1.txt","On Contemporary Social Theory"
"journal-article-10.2307_27702552-ngram1.txt","Introduction to the Special Issue: Sociology and Social Policy"
"journal-article-10.2307_41485700-ngram1.txt","Listening to Sociological Elders: An Interview with Maurice R. Stein"
"journal-article-10.2307_43955599-ngram1.txt","How PSA's Inclusion Shift Cracked the Ivory Tower Culture and Led to New Governance Challenges"
"journal-article-10.2307_43956312-ngram1.txt","Introduction"
"journal-article-10.2307_27698737-ngram1.txt","journal-article-10.2307_27698737-ngram1.txt"
"journal-article-10.2307_27698788-ngram1.txt","The Postmodernist Shuffle"
"journal-article-10.2307_27698930-ngram1.txt","Integrating Professional Socialization and Training for Sociology Graduate Students"
"journal-article-10.2307_27700284-ngram1.txt","Ceremonial Degradation of a Doctoral Candidate: An Essay on the Social Situation of Graduate Student Ethnographers and Other Inmates"
"journal-article-10.2307_27701304-ngram1.txt","The Sampling of Behavior"
"journal-article-10.2307_27701365-ngram1.txt","Discipline, Method, Community Structure, and Decision-Making: The Role and Limitations of the Sociology of Knowledge"
"journal-article-10.2307_27701629-ngram1.txt","Some Comments on Edward Gross's \"Universities as Organizations: A Research Approach\""
"journal-article-10.2307_27702099-ngram1.txt","Sociology, Selective Determinism, and the Rise of Expectations"
"journal-article-10.2307_27702113-ngram1.txt","Brief Remarks on the Association's Code of Ethics"
"journal-article-10.2307_27702340-ngram1.txt","The New Academic Hustle: Marketing a PhD"
"journal-article-10.2307_27702463-ngram1.txt","The ASA: Trends and Evolution"
"journal-article-10.2307_27702539-ngram1.txt","Graduate Education in an Age of Decline"
"journal-article-10.2307_27698437-ngram1.txt","From a Committed Achiever to a Radical Social Scientist: The Life Course Dialectics of a \"Marginal\" Black American Sociologist"
"journal-article-10.2307_27698482-ngram1.txt","\"The Sociological Imagination\": Reclaiming a Vision?"
"journal-article-10.2307_27700357-ngram1.txt","First Words: Do Sociologists Actually Use the Terms in Introductory Textbooks' Glossaries?"
"journal-article-10.2307_27701236-ngram1.txt","Back Matter"
"journal-article-10.2307_27701261-ngram1.txt","Ernest Watson Burgess, 1886-1966: Contributions in the Field of Marriage and the Family"
"journal-article-10.2307_27701362-ngram1.txt","The Littlest Science"
"journal-article-10.2307_27701413-ngram1.txt","Dirty Old Data"
"journal-article-10.2307_27701500-ngram1.txt","Back Matter"
"journal-article-10.2307_27701623-ngram1.txt","Should the Sociology Profession Take Moral Stands on Political Issues?"
"journal-article-10.2307_27701730-ngram1.txt","News from Departments"
"journal-article-10.2307_27701980-ngram1.txt","Employment Bulletin"
"journal-article-10.2307_27701992-ngram1.txt","Front Matter"
"journal-article-10.2307_27702129-ngram1.txt","The Sexual Context of Social Research"
"journal-article-10.2307_27702147-ngram1.txt","The Notion of Appropriate Professional Conduct: An Exercise in the Sociology of Sociology [with Reply and Rejoinder]"
"journal-article-10.2307_27702154-ngram1.txt","The Challenge of Applied Sociology"
"journal-article-10.2307_27702440-ngram1.txt","Seventy-Five Years of American Sociology in Relation to Social Work"
"journal-article-10.2307_27702571-ngram1.txt","journal-article-10.2307_27702571-ngram1.txt"
"journal-article-10.2307_41485729-ngram1.txt","Philosophy on the Ground: An Appreciation of a \"Spirit Master\""
"journal-article-10.2307_27698420-ngram1.txt","Producing Sociology: Time Trends in Authorship of Journal Articles, 1975-1986"
"journal-article-10.2307_27698556-ngram1.txt","Reflections on Dangerous Fieldwork"
"journal-article-10.2307_27698711-ngram1.txt","The New Crisis of Legitimacy in Controls, Prisons, and Legal Structures"
"journal-article-10.2307_27698774-ngram1.txt","An Ethnographic Exploration of Science in American Life"
"journal-article-10.2307_27701273-ngram1.txt","Back Matter"
"journal-article-10.2307_27701363-ngram1.txt","Using Our Heads"
"journal-article-10.2307_27701481-ngram1.txt","On the Influence, Affluence, and Congruence of Phenomena in the Social Sciences"
"journal-article-10.2307_27701505-ngram1.txt","The Puritan Ethic in Universities and Some Worldly Concerns of Sociologists"
"journal-article-10.2307_27701604-ngram1.txt","Problems in the Interpretation of F Ratios for Hypotheses of Differences between Means"
"journal-article-10.2307_27701664-ngram1.txt","The Role of the Sociologist on Public Issues: An Exercise in the Sociology of Knowledge"
"journal-article-10.2307_27701670-ngram1.txt","Problem-Solving Computer Systems for Instruction in Sociology"
"journal-article-10.2307_27702534-ngram1.txt","Teaching Theory in an Empirically-Oriented Graduate Program"
"journal-article-10.2307_27702581-ngram1.txt","The Overlooked Contributions of Applied Work in Sociology: Who Now Reads S.A. Rice?"
"journal-article-10.2307_40983488-ngram1.txt","The Blame Game"
"journal-article-10.2307_41217771-ngram1.txt","Editor's Introduction: Sociologists and Administrators"
"journal-article-10.2307_43955587-ngram1.txt","Guest Editors' Introduction"
"journal-article-10.2307_27698512-ngram1.txt","Autobiographical Sociology"
"journal-article-10.2307_27698605-ngram1.txt","The Three Eras of \"The American Sociologist\""
"journal-article-10.2307_27700483-ngram1.txt","Being (George Ritzer) and Nothingness: An Interview"
"journal-article-10.2307_27701266-ngram1.txt","Comments on a Proposal to Establish a National Foundation for the Social Sciences"
"journal-article-10.2307_27701289-ngram1.txt","Front Matter"
"journal-article-10.2307_27701299-ngram1.txt","Family Names and Social Class: A Teaching Technique"
"journal-article-10.2307_27701355-ngram1.txt","Official Reports and Proceedings"
"journal-article-10.2307_27701576-ngram1.txt","An Innovative Course in Urban Sociology"
"journal-article-10.2307_27701729-ngram1.txt","News of Other Organizations"
"journal-article-10.2307_27701742-ngram1.txt","Data Analysis for Sociology Undergraduates: Innovations of Instant Computation"
"journal-article-10.2307_27701841-ngram1.txt","Political Intrusion and Governmental Confusion: The Case of the National Institute of Law Enforcement and Criminal Justice"
"journal-article-10.2307_27701874-ngram1.txt","Negro Academics and Professional Societies"
"journal-article-10.2307_27701957-ngram1.txt","A Proposal for Graduate Training"
"journal-article-10.2307_27702116-ngram1.txt","Letters"
"journal-article-10.2307_42635362-ngram1.txt","Some Trends in the Prestige of U.S. Ph.D. Programs in Sociology, 1976-2011"
"journal-article-10.2307_27698436-ngram1.txt","A Mexican American Woman Encounters Sociology: An Autobiographical Perspective"
"journal-article-10.2307_27698441-ngram1.txt","Academic Odyssey: The Training of an African Sociologist"
"journal-article-10.2307_27701446-ngram1.txt","Eminence, Productivity, and Power of Sociologists in Various Regions"
"journal-article-10.2307_27701477-ngram1.txt","Science and Scientism: The State of Sociology"
"journal-article-10.2307_27701662-ngram1.txt","Front Matter"
"journal-article-10.2307_27701933-ngram1.txt","Employment Bulletin"
"journal-article-10.2307_27702280-ngram1.txt","The College Market in Commercial Publishing: The Case of the Convertible?"
"journal-article-10.2307_27702422-ngram1.txt","Toward a Theory of Publishing of Perishing"
"journal-article-10.2307_27698495-ngram1.txt","Washington University's Pig Roast: Ending Sociology and Jeopardizing Liberal Arts"
"journal-article-10.2307_27698575-ngram1.txt","What Do We Really Teach in Introductory Sociology Textbooks? Three Underlying Messages and Their Instructional Implications"
"journal-article-10.2307_27701222-ngram1.txt","Back Matter"
"journal-article-10.2307_27701256-ngram1.txt","Back Matter"
"journal-article-10.2307_27701264-ngram1.txt","The Cretan Dictum: A Functional Analysis of Sociology"
"journal-article-10.2307_27701570-ngram1.txt","Teaching as Fieldwork"
"journal-article-10.2307_27701590-ngram1.txt","ASA News"
"journal-article-10.2307_27701873-ngram1.txt","The Solution Cycle of Social Problems"
"journal-article-10.2307_27702089-ngram1.txt","Jewish-Nonjewish Differences on the Vietnam War: A Study of Social Psychologists"
"journal-article-10.2307_27702468-ngram1.txt","Sociology and Human Knowledge: Scientific vs. Folk Methods"
"journal-article-10.2307_27702492-ngram1.txt","Artifacts Are in the Mind of the Beholder"
"journal-article-10.2307_27702555-ngram1.txt","Family Sociologists and Policymaking: A Supporting Role Perspective"
"journal-article-10.2307_43955606-ngram1.txt","Community College Participation in the Pacific Sociological Association"
"journal-article-10.2307_27698839-ngram1.txt","New Frontiers: Remote Sensing in Social Science Research"
"journal-article-10.2307_27698871-ngram1.txt","Comments on Parsons's \"Simmel and the Methodological Problems of Formal Sociology\""
"journal-article-10.2307_27701295-ngram1.txt","The Scientific Training of Introductory Sociology Students"
"journal-article-10.2307_27701366-ngram1.txt","Class, Status, and Savings of Negroes"
"journal-article-10.2307_27701497-ngram1.txt","ASA News"
"journal-article-10.2307_27701758-ngram1.txt","ASA News"
"journal-article-10.2307_27701946-ngram1.txt","The Silent Science"
"journal-article-10.2307_27702068-ngram1.txt","Sex Role Imagery and Use of the Generic \"Man\" in Introductory Texts: A Case in the Sociology of Sociology"
"journal-article-10.2307_27702104-ngram1.txt","On the Use of the \"Science Citation Index\" in Sociology"
"journal-article-10.2307_27702273-ngram1.txt","Field Research and Future History: Problems Posed for Ethnographic Sociologists by the \"Doomsday Cult\" Making Good"
"journal-article-10.2307_27702379-ngram1.txt","Field Work and the Protection of Human Subjects"
"journal-article-10.2307_27702407-ngram1.txt","Retired Sociologists' Expectations for Professional Immortality: Further Demonstrations of the Constructed Nature of Reality"
"journal-article-10.2307_27702505-ngram1.txt","Goals in Teaching Undergraduates in Black Colleges and Universities: Professional-Centered or Client-Centered?"
"journal-article-10.2307_41485705-ngram1.txt","Wiley's Contribution to Symbolic Interactionist Theory"
"journal-article-10.2307_27698547-ngram1.txt","The Organizational Politics of the ASA"
"journal-article-10.2307_27698552-ngram1.txt","Re-forming the SSSP: Questions of \"Praxis\""
"journal-article-10.2307_27698776-ngram1.txt","Reviewing the Reviewers: The Bell Curve"
"journal-article-10.2307_27698787-ngram1.txt","Research on Informed Consent: Unexpected Impacts"
"journal-article-10.2307_27698862-ngram1.txt","The American Sociological Association Dues Structure"
"journal-article-10.2307_27698953-ngram1.txt","The Parsons/Tominaga \"Colloquy\" at Iwanami Shoten"
"journal-article-10.2307_27700339-ngram1.txt","Seymour Martin Lipset: The Social Uses of Anomaly"
"journal-article-10.2307_27700426-ngram1.txt","Ambition, Vocation, and Sociology"
"journal-article-10.2307_27701162-ngram1.txt","The Editor's Column"
"journal-article-10.2307_27701165-ngram1.txt","Communications to the Editor"
"journal-article-10.2307_27701357-ngram1.txt","Supplementary Information: Guide to Graduate Departments of Sociology"
"journal-article-10.2307_27701746-ngram1.txt","Reports"
"journal-article-10.2307_27701770-ngram1.txt","Policies for Book Reviews in the New ASA Book Review Journal"
"journal-article-10.2307_27701809-ngram1.txt","Student Evaluations of Courses and Instructors"
"journal-article-10.2307_27702042-ngram1.txt","Journal Productivity of PH.D. Sociologists"
"journal-article-10.2307_27702080-ngram1.txt","A Course in Small Group Sociology"
"journal-article-10.2307_27702091-ngram1.txt","Reverse Discrimination in Hiring in Sociology Departments: A Preliminary Report"
"journal-article-10.2307_27702095-ngram1.txt","What Is Sociological Theory?"
"journal-article-10.2307_27702141-ngram1.txt","Uses of the Masters"
"journal-article-10.2307_27702144-ngram1.txt","Stability and Concentration of National Science Foundation Funding in Sociology, 1964-1971"
"journal-article-10.2307_27702173-ngram1.txt","On the Determinants of Student Performance in Introductory Courses in the Social Sciences"
"journal-article-10.2307_40983491-ngram1.txt","Chuck Tilly and Mozart"
"journal-article-10.2307_41485734-ngram1.txt","Cooks Cooking Up Recipes: The Cash Value of Nouns, Verbs and Grammar"
"journal-article-10.2307_43955597-ngram1.txt","Some Thoughts on Sociology Journal Publishing In The 21st Century"
"journal-article-10.2307_20638841-ngram1.txt","Why Sociology Abandoned Communication"
"journal-article-10.2307_27698479-ngram1.txt","Re-Reading \"The Sociological Imagination\""
"journal-article-10.2307_27698855-ngram1.txt","Fated to Be a Professor?"
"journal-article-10.2307_27700364-ngram1.txt","Remembering Reuel Denney: Sociology as Cultural Studies"
"journal-article-10.2307_27701164-ngram1.txt","Behavioral Science Research in Growth and Development"
"journal-article-10.2307_27701206-ngram1.txt","Official Reports and Proceedings"
"journal-article-10.2307_27701216-ngram1.txt","Communications to the Editor"
"journal-article-10.2307_27701243-ngram1.txt","The Federal Reports Act"
"journal-article-10.2307_27701367-ngram1.txt","Criteria for Selecting a Significance Level: A Note on the Sacredness of .05"
"journal-article-10.2307_27701807-ngram1.txt","Assuring Confidentiality of Responses in Social Research: A Note on Strategies"
"journal-article-10.2307_27701837-ngram1.txt","The Benign Quota: Panacea or Pandora's Box"
"journal-article-10.2307_27702188-ngram1.txt","Marx and Others on the Family: Will the Real Sociologist Stand Up? [with Comment]"
"journal-article-10.2307_27702509-ngram1.txt","The Sociologist: There and Here"
"journal-article-10.2307_27702541-ngram1.txt","Two Different Worlds: The Academic Orientation of Graduate Education vs. the Realities of One Applied Career"
"journal-article-10.2307_27702544-ngram1.txt","The Growth of the Sociology Graduate Program at Kent State University"
"journal-article-10.2307_27702557-ngram1.txt","The Responsive Community (I &amp; We)"
"journal-article-10.2307_43955605-ngram1.txt","Reflections on My PSA Scholarship of Teaching and Learning Experiences"
"journal-article-10.2307_27698432-ngram1.txt","Introduction to the Special Issue: Not Quite in the Club"
"journal-article-10.2307_27698536-ngram1.txt","An Unprincipled Ethic?: The Missing Morality of the ASA Code"
"journal-article-10.2307_27698537-ngram1.txt","Sociological Theory: Looking Forward"
"journal-article-10.2307_27698555-ngram1.txt","Standardizing Basic Concepts in Sociology"
"journal-article-10.2307_27698592-ngram1.txt","Guest Editor's Comments"
"journal-article-10.2307_27698972-ngram1.txt","journal-article-10.2307_27698972-ngram1.txt"
"journal-article-10.2307_27700331-ngram1.txt","William F. Whyte: An Appreciation"
"journal-article-10.2307_27700346-ngram1.txt","An Analysis of U.S. Civil Society"
"journal-article-10.2307_27701188-ngram1.txt","Back Matter"
"journal-article-10.2307_27701333-ngram1.txt","Sociology in Australia and New Zealand"
"journal-article-10.2307_27702109-ngram1.txt","The Potential Impact of B. F. Skinner upon American Sociology"
"journal-article-10.2307_27702210-ngram1.txt","Sociologists Should Be Put to Work as Forecasters"
"journal-article-10.2307_27702216-ngram1.txt","The Concept of Reverse Discrimination and Equality of Opportunity"
"journal-article-10.2307_27702219-ngram1.txt","And Some Are More Equal than Others"
"journal-article-10.2307_27702235-ngram1.txt","Multiple Submissions: Why Not?"
"journal-article-10.2307_27702257-ngram1.txt","Reply to Professor Liska"
"journal-article-10.2307_27702324-ngram1.txt","Geology and Sociology: Problems and Prospects of the 'Soft' Sciences"
"journal-article-10.2307_27702452-ngram1.txt","Errata: Sociology in Japan and \"Shakai-Ishikiron\""
"journal-article-10.2307_27702490-ngram1.txt","Should Sociologists Forget Their Mothers and Fathers"
"journal-article-10.2307_41485724-ngram1.txt","Melvin Pollner and Ethnomethodology"
"journal-article-10.2307_27698460-ngram1.txt","Potential Expansion of the Academic Job Market: Opportunities for Sociologists"
"journal-article-10.2307_27698854-ngram1.txt","Editor's Inaugural Statement"
"journal-article-10.2307_27700341-ngram1.txt","When Leadership Failed"
"journal-article-10.2307_27700517-ngram1.txt","Some Issues in Comparative, Macro and International Work in the History of Sociology"
"journal-article-10.2307_27701197-ngram1.txt","Communications to the Editor"
"journal-article-10.2307_27701290-ngram1.txt","... Who Shall Prepare Himself to the Battle?"
"journal-article-10.2307_27701335-ngram1.txt","Pitirim A. Sorokin"
"journal-article-10.2307_27701549-ngram1.txt","On the Impossibility of a Complete, General Theory of Behavior"
"journal-article-10.2307_27701827-ngram1.txt","Back Matter"
"journal-article-10.2307_27701846-ngram1.txt","Social Science and Social Policy: A Review of Some Recent Books"
"journal-article-10.2307_27702039-ngram1.txt","Measuring Sociological Productivity: A Review and a Proposal"
"journal-article-10.2307_27702161-ngram1.txt","Applications of the 1970 Census Public Use Samples in Affirmative Action Programs"
"journal-article-10.2307_27702206-ngram1.txt","Coser's... \"In Search of Substance\""
"journal-article-10.2307_27702584-ngram1.txt","Hidden Jobs: Good News for Sociologists"
"journal-article-10.2307_40983487-ngram1.txt","Charles Tilly as a Theorist of Nationalism"
"journal-article-10.2307_42635375-ngram1.txt","Teaching Sociology at a Tribal College: Navajo Philosophy as a Pedagogy"
"journal-article-10.2307_27698498-ngram1.txt","Reflexivity and Alvin Gouldner: \"The Coming Crisis\" in 1990"
"journal-article-10.2307_27698817-ngram1.txt","On the Landscape of the Relation between Hannah Arendt and Martin Heidegger"
"journal-article-10.2307_27698923-ngram1.txt","The American Sociologist: Characteristics in the 1990s"
"journal-article-10.2307_27700254-ngram1.txt","Differentiation and Complexity in the Functionalist Corpus: Rethinking the Metaphor of System"
"journal-article-10.2307_27701246-ngram1.txt","Suggestions to Aid the Student in Systematic Interpretation and Analysis of Empirical Sociological Journal Presentations"
"journal-article-10.2307_27701328-ngram1.txt","The Most Cited Sociologists: An Analysis of Introductory Text Citations"
"journal-article-10.2307_27701601-ngram1.txt","Some Observations on the Relationships between Research Productivity and Student Evaluations of Courses and Teaching"
"journal-article-10.2307_27701695-ngram1.txt","Announcements from Other Organizations"
"journal-article-10.2307_27701748-ngram1.txt","A Response to Bradley and Reynolds"
"journal-article-10.2307_27702060-ngram1.txt","News and Notes on Minorities and Women"
"journal-article-10.2307_27702094-ngram1.txt","Does the Master's Make a Difference?"
